{
  "$schema": "https://json-schema.org/draft/2020-12/schema",
  "$id": "https://github.com/binhvugia1997-ui/app-ch-p-nh/specs/schemas/rule-set.schema.json",
  "title": "PhotographyRuleSet",
  "description": "A versioned collection of rule database entries (see rule.schema.json for one entry). Markdown (docs/photography-rules.md) is normative for meaning; this JSON is normative for IDs, classes, severities, phases and threshold status. A rule that is only described in prose is NOT in this file yet: rules are added here when their phase begins and their entry is specified to implementation depth.",
  "type": "object",
  "required": ["version", "status", "rules"],
  "additionalProperties": false,
  "properties": {
    "$schema": { "type": "string" },
    "version": { "type": "string", "pattern": "^[0-9]+\\.[0-9]+\\.[0-9]+$" },
    "status": { "enum": ["PHASE_0_DRAFT", "DRAFT", "CALIBRATING", "RELEASED"] },
    "notes": { "type": "array", "items": { "type": "string" } },
    "rules": {
      "type": "array",
      "minItems": 1,
      "items": { "$ref": "rule.schema.json" }
    }
  }
}
