{
  "$schema": "../schemas/rule-set.schema.json",
  "version": "0.1.0",
  "status": "PHASE_0_DRAFT",
  "notes": [
    "Normative for rule IDs, classes, severities, implementation phases and threshold status. Prose meaning lives in docs/photography-rules.md.",
    "Scope: the rules specified to implementation depth (Phases 4-6). Rules described only in prose in docs/photography-rules.md are added here when their phase begins.",
    "Every threshold with status CALIBRATION_REQUIRED must not drive a user-visible hard error until calibrated on local captures (enforced by a unit test).",
    "Threshold values here are proposals. They are not evidence."
  ],
  "rules": [
    {
      "ruleId": "FRAME_SUBJECT_PRESENT",
      "name": "Subject present and usable",
      "category": "FRAMING",
      "purpose": "Gate for every other framing/pose rule; drives the no-subject UI state.",
      "class": "HIGH_CONFIDENCE_ERROR",
      "detectability": "DETERMINISTIC",
      "actor": "PHOTOGRAPHER",
      "severity": "BLOCKING",
      "blockingAllowed": true,
      "applicableShotTypes": [
        "ANY"
      ],
      "requiredInputs": [
        "subjects[].visibleFraction",
        "subjects[].bbox"
      ],
      "detectionMethod": [
        "Pick the most prominent subject: prominence = visibleFraction * sqrt(bboxArea).",
        "If visibleFraction < V_min, report SUBJECT_PARTIAL.",
        "If no subject for N_absent consecutive frames, report NO_SUBJECT."
      ],
      "math": "prominence = visibleFraction * sqrt(bboxArea)",
      "thresholds": [
        {
          "name": "V_min",
          "value": 0.55,
          "unit": "ratio",
          "status": "CALIBRATION_REQUIRED",
          "exitValue": 0.6,
          "firesWhen": "below"
        },
        {
          "name": "N_absent",
          "value": 15,
          "unit": "frames@30fps",
          "status": "CALIBRATION_REQUIRED",
          "firesWhen": "above"
        }
      ],
      "confidenceCap": 0.95,
      "suggestedActions": [
        "WAIT"
      ],
      "allowedActions": [
        "WAIT"
      ],
      "conflictingRules": [],
      "failureCases": [
        "partially occluded subject",
        "subject beyond ~4 m (model-card limit)",
        "severe motion blur"
      ],
      "implementationPriority": "MVP",
      "phase": 5,
      "complexity": "S"
    },
    {
      "ruleId": "FRAME_SUBJECT_TOO_SMALL",
      "name": "Subject too small for the intended shot type",
      "category": "FRAMING",
      "purpose": "A small subject cannot be judged and the pose is unreadable.",
      "class": "HIGH_CONFIDENCE_ERROR",
      "detectability": "DETERMINISTIC",
      "actor": "PHOTOGRAPHER",
      "severity": "IMPORTANT",
      "blockingAllowed": false,
      "applicableShotTypes": [
        "FULL_BODY",
        "THREE_QUARTER",
        "HALF_BODY",
        "CLOSE_PORTRAIT",
        "HEADSHOT"
      ],
      "requiredInputs": [
        "subjects[].bbox",
        "subjects[].face.bbox",
        "intendedShotType"
      ],
      "detectionMethod": [
        "Compute h_body = bbox.height and h_face = faceBBox.height in normalized frame units.",
        "Compare with the band for the intended shot type.",
        "Enter when below the band minimum; exit 10% inside the band."
      ],
      "math": "bands (proposal, CALIBRATION_REQUIRED): FULL_BODY 0.75-0.98; THREE_QUARTER 0.55-0.85; HALF_BODY 0.35-0.60; CLOSE_PORTRAIT face 0.18-0.35; HEADSHOT face 0.28-0.45",
      "thresholds": [
        {
          "name": "fullBodyMin",
          "value": 0.75,
          "unit": "ratio_of_frame_height",
          "status": "CALIBRATION_REQUIRED",
          "source": "PRACTITIONER/CALIBRATION",
          "exitValue": 0.79,
          "firesWhen": "below"
        },
        {
          "name": "extremeWarnOnly",
          "value": 0.25,
          "unit": "ratio_of_frame_height",
          "status": "CALIBRATION_REQUIRED",
          "source": "used when no shot type is selected",
          "firesWhen": "below"
        }
      ],
      "confidenceCap": 0.95,
      "suggestedActions": [
        "MOVE_CLOSER",
        "ZOOM_IN"
      ],
      "allowedActions": [
        "MOVE_CLOSER",
        "ZOOM_IN"
      ],
      "conflictingRules": [
        "FRAME_EDGE_MARGIN",
        "FRAME_HEADROOM_EXCESSIVE",
        "FRAME_HEADROOM_INSUFFICIENT",
        "FRAME_JOINT_CROP",
        "FRAME_SUBJECT_TOO_LARGE"
      ],
      "failureCases": [
        "bbox clipped by the frame edge",
        "loose clothing",
        "overlapping people"
      ],
      "implementationPriority": "MVP",
      "phase": 5,
      "complexity": "S"
    },
    {
      "ruleId": "FRAME_SUBJECT_TOO_LARGE",
      "name": "Subject too large / cropped by the frame",
      "category": "FRAMING",
      "purpose": "A subject that overflows the frame reads as an accident unless deliberately tight.",
      "class": "HIGH_CONFIDENCE_ERROR",
      "detectability": "DETERMINISTIC",
      "actor": "PHOTOGRAPHER",
      "severity": "IMPORTANT",
      "blockingAllowed": false,
      "applicableShotTypes": [
        "FULL_BODY",
        "THREE_QUARTER",
        "HALF_BODY"
      ],
      "requiredInputs": [
        "subjects[].bbox",
        "intendedShotType"
      ],
      "detectionMethod": [
        "h_body compared against the band maximum.",
        "Enter above the band maximum; exit 10% inside."
      ],
      "math": "see FRAME_SUBJECT_TOO_SMALL bands",
      "thresholds": [
        {
          "name": "fullBodyMax",
          "value": 0.98,
          "unit": "ratio_of_frame_height",
          "status": "CALIBRATION_REQUIRED",
          "exitValue": 0.94,
          "firesWhen": "above"
        }
      ],
      "confidenceCap": 0.95,
      "suggestedActions": [
        "MOVE_FARTHER",
        "ZOOM_OUT"
      ],
      "allowedActions": [
        "MOVE_FARTHER",
        "ZOOM_OUT"
      ],
      "conflictingRules": [
        "FRAME_EDGE_MARGIN",
        "FRAME_JOINT_CROP",
        "FRAME_SUBJECT_TOO_SMALL"
      ],
      "failureCases": [
        "deliberate tight crop",
        "subject walking toward the camera"
      ],
      "implementationPriority": "MVP",
      "phase": 5,
      "complexity": "S"
    },
    {
      "ruleId": "FRAME_HEADROOM_EXCESSIVE",
      "name": "Excessive headroom",
      "category": "FRAMING",
      "purpose": "Most consistently cited portrait framing error; trivially measurable.",
      "class": "HIGH_CONFIDENCE_ERROR",
      "detectability": "HYBRID",
      "actor": "PHOTOGRAPHER",
      "severity": "IMPORTANT",
      "blockingAllowed": false,
      "applicableShotTypes": [
        "HEADSHOT",
        "CLOSE_PORTRAIT",
        "HALF_BODY",
        "THREE_QUARTER",
        "FULL_BODY"
      ],
      "requiredInputs": [
        "subjects[].landmarks(eyes,ears,nose)",
        "frame.height",
        "intendedShotType"
      ],
      "detectionMethod": [
        "Estimate headTopY: fit a circle through both eyes and both ears; headTopY = centreY - k * radius.",
        "headroomRatio = headTopY (normalized distance from the frame top).",
        "Compare with the band for the intended shot type; require eyes/ears visibility >= 0.5."
      ],
      "math": "headTopY = circleCentreY - k * circleRadius, k ~ 1.45 (CALIBRATION_REQUIRED); headroomRatio = headTopY / frameHeight",
      "thresholds": [
        {
          "name": "headshotMax",
          "value": 0.14,
          "unit": "ratio_of_frame_height",
          "status": "CALIBRATION_REQUIRED",
          "source": "PRACTITIONER; crafting convention 1/8-1/4 for head-and-shoulders",
          "exitValue": 0.11,
          "firesWhen": "above"
        },
        {
          "name": "fullBodyMax",
          "value": 0.2,
          "unit": "ratio_of_frame_height",
          "status": "CALIBRATION_REQUIRED",
          "exitValue": 0.16,
          "firesWhen": "above"
        },
        {
          "name": "headTopK",
          "value": 1.45,
          "unit": "dimensionless",
          "status": "CALIBRATION_REQUIRED",
          "firesWhen": "above"
        }
      ],
      "confidenceCap": 0.85,
      "suggestedActions": [
        "DECREASE_HEADROOM"
      ],
      "allowedActions": [
        "DECREASE_HEADROOM"
      ],
      "conflictingRules": [
        "COMP_EYE_LINE_PLACEMENT",
        "FRAME_SUBJECT_TOO_SMALL"
      ],
      "failureCases": [
        "head partially out of frame (abstain)",
        "hats/hair volume",
        "camera roll > 10 deg",
        "head not upright"
      ],
      "implementationPriority": "MVP",
      "phase": 5,
      "complexity": "M"
    },
    {
      "ruleId": "FRAME_HEADROOM_INSUFFICIENT",
      "name": "Insufficient headroom / head near the top edge",
      "category": "FRAMING",
      "purpose": "A head jammed against (or cut by) the top edge looks cramped.",
      "class": "HIGH_CONFIDENCE_ERROR",
      "detectability": "HYBRID",
      "actor": "PHOTOGRAPHER",
      "severity": "IMPORTANT",
      "blockingAllowed": false,
      "applicableShotTypes": [
        "HEADSHOT",
        "CLOSE_PORTRAIT",
        "HALF_BODY",
        "THREE_QUARTER",
        "FULL_BODY"
      ],
      "requiredInputs": [
        "subjects[].landmarks",
        "frame.height"
      ],
      "detectionMethod": [
        "Same headTopY estimate as FRAME_HEADROOM_EXCESSIVE.",
        "Enter below the band minimum; exit 10% inside."
      ],
      "math": "headroomRatio < bandMin",
      "thresholds": [
        {
          "name": "headshotMin",
          "value": 0.04,
          "unit": "ratio_of_frame_height",
          "status": "CALIBRATION_REQUIRED",
          "exitValue": 0.055,
          "firesWhen": "below"
        },
        {
          "name": "fullBodyMin",
          "value": 0.03,
          "unit": "ratio_of_frame_height",
          "status": "CALIBRATION_REQUIRED",
          "exitValue": 0.045,
          "firesWhen": "below"
        }
      ],
      "confidenceCap": 0.85,
      "suggestedActions": [
        "INCREASE_HEADROOM"